{
  "关键词": "半导体设备国产替代",
  "研究范围": "设备公司、订单、客户验证、政策和财报线索",
  "收集状态": "仅规划收集",
  "材料收集计划": [
    {
      "材料方向": "公司公告和财报",
      "优先来源": ["交易所公告", "公司官网", "定期报告"],
      "需要回答的问题": "订单增长、合同负债、收入确认和毛利率是否有披露依据。",
      "预期用途": "建立状态观测和验证信号。"
    },
    {
      "材料方向": "行业深度和历史案例",
      "优先来源": ["券商行业深度", "历史财报点评", "产业数据库"],
      "需要回答的问题": "订单增长到收入确认的传导在历史上是否反复出现，失效边界是什么。",
      "预期用途": "判断是否可升级为历史支持模板候选。"
    }
  ],
  "材料": [],
  "后续建议": [
    "当前未实际访问来源，因此不能列出已收集材料。",
    "下一步应优先收集公告、财报和历史案例，再进入本体化抽取。"
  ]
}
